{
  "generatedAt": "2026-09-02T01:53:23.872738Z",
  "items": [
    {
      "expiresAt": "2026-09-05T00:00:00Z",
      "id": "nyc-service-volunteer-search",
      "officialUrl": "https://www.nyc.gov/html/nycservice/home.html",
      "organizer": {
        "id": "nyc-service",
        "name": "NYC Service"
      },
      "participation": {
        "riskClarity": "Requirements are set by each hosting opportunity and should be reviewed before signing up.",
        "timeCommitment": "Varies; confirm with the hosting organization.",
        "whatYouWillDo": "Choose a community-service opportunity published through the City service office."
      },
      "source": {
        "authorityTier": "local_government",
        "name": "NYC Service",
        "reviewStatus": "verified",
        "url": "https://www.nyc.gov/html/nycservice/home.html"
      },
      "summary": "Find community volunteer opportunities through New York City's official service office.",
      "timeCommitment": "Varies by opportunity",
      "title": "NYC Service volunteer opportunities"
    }
  ],
  "producer": {
    "name": "Gremlin Lab",
    "version": "development"
  },
  "regionId": "nyc",
  "schemaVersion": 1
}
