{
  "generatedAt": "2026-09-02T01:53:23.872738Z",
  "items": [
    {
      "id": "nyc-service",
      "name": "NYC Service",
      "officialUrl": "https://www.nyc.gov/html/nycservice/home.html",
      "source": {
        "authorityTier": "local_government",
        "name": "NYC Service",
        "reviewStatus": "verified",
        "url": "https://www.nyc.gov/html/nycservice/home.html"
      },
      "summary": "New York City's service office, which directs residents to volunteer opportunities."
    }
  ],
  "producer": {
    "name": "Gremlin Lab",
    "version": "development"
  },
  "regionId": "nyc",
  "schemaVersion": 1
}
